{
  "receipt_id": "REC-1781465922344-84",
  "command_id": "CMD-1781465922291-321",
  "created_at": "2026-06-14T19:38:42.344Z",
  "status": "COMPLETE",
  "files_created": [
    "CommandLedger\\dry_run\\CMD-1781465922291-321_run.txt"
  ],
  "files_modified": [],
  "files_deleted": [],
  "secrets_printed": false,
  "live_systems_touched": false,
  "protected_surfaces_touched": [
    "CommandLedger/approved/",
    "CommandLedger/in_progress/"
  ],
  "summary": "Successfully executed dry-run ping command: PING_AG_FROM_NEWTON_DRY_RUN. Output file generated.",
  "next_safe_step": "Implement GitHub API connection hook for remote repository ledger synchronization."
}